1263241029.251303 IP 79.102.242.2.60535 > 91.123.195.179.80: P 2908502772:2908503262(490) ack 709526695 win 46 <nop,nop,timestamp 11311488 169493467>
1263241029.252353 IP 91.123.195.179.80 > 79.102.242.2.60535: P 709526695:709526949(254) ack 2908503262 win 215 <nop,nop,timestamp 169493491 11311488>
1263241030.638604 IP 79.102.242.2.60535 > 91.123.195.179.80: P 2908503262:2908503739(477) ack 709526949 win 54 <nop,nop,timestamp 11311642 169493491>
1263241030.639528 IP 91.123.195.179.80 > 79.102.242.2.60535: P 709526949:709527202(253) ack 2908503739 win 248 <nop,nop,timestamp 169493630 11311642>
1263241031.621691 IP 79.102.242.2.60535 > 91.123.195.179.80: P 2908503739:2908504209(470) ack 709527202 win 63 <nop,nop,timestamp 11311740 169493630>
1263241031.623903 IP 91.123.195.179.80 > 79.102.242.2.60535: P 709527202:709527455(253) ack 2908504209 win 282 <nop,nop,timestamp 169493728 11311740>
1263241032.540757 IP 79.102.242.2.60535 > 91.123.195.179.80: P 2908504209:2908504633(424) ack 709527455 win 71 <nop,nop,timestamp 11311831 169493728>
1263241032.659558 IP 91.123.195.179.80 > 79.102.242.2.60535: P 709531559:709532034(475) ack 2908504633 win 315 <nop,nop,timestamp 169493832 11311845>
1263241032.962095 IP 79.102.242.2.60535 > 91.123.195.179.80: P 2908504633:2908505056(423) ack 709532034 win 157 <nop,nop,timestamp 11311874 169493832>
1263241032.974350 IP 91.123.195.179.80 > 79.102.242.2.60535: P 709534770:709534941(171) ack 2908505056 win 349 <nop,nop,timestamp 169493863 11311874>
1263241034.053050 IP 79.102.242.2.60535 > 91.123.195.179.80: P 2908505056:2908505524(468) ack 709534941 win 221 <nop,nop,timestamp 11311983 169493863>
1263241034.054304 IP 91.123.195.179.80 > 79.102.242.2.60535: P 709534941:709535194(253) ack 2908505524 win 382 <nop,nop,timestamp 169493971 11311983>
1263241036.440678 IP 79.102.242.2.60535 > 91.123.195.179.80: P 2908505524:2908505988(464) ack 709535194 win 242 <nop,nop,timestamp 11312222 169493971>
1263241036.442082 IP 91.123.195.179.80 > 79.102.242.2.60535: P 709535194:709535447(253) ack 2908505988 win 416 <nop,nop,timestamp 169494210 11312222>

